ticket_id,title,description,category,priority,status,resolution,created_at,resolved_at,assigned_agent
TKT-0216,Corrupted data in customer table,184 records in customer table show NULL values in mandatory fields after last migration.,Database,High,resolved,Data corruption traced to failed migration script with incorrect NULL handling. Restored affected records from pre-migration backup. Validated data integrity.,2024-04-05T21:37:00,2024-04-06T04:37:00,Agent_B
TKT-0218,Data center cooling alert,Cooling system in DC-4 reporting high temperature warning. Room temp at 33°C. Need HVAC check.,Infrastructure,High,resolved,Escalated to data center team. HVAC unit serviced and repaired. Temperature normalized within safe operating range. No hardware damage detected.,2024-02-14T05:27:00,2024-02-14T13:27:00,Agent_A
TKT-0219,VM not starting after maintenance,Virtual machine VM-462 fails to boot after scheduled maintenance window. Error: kernel panic at boot.,Infrastructure,Medium,resolved,Restored VM from last known good snapshot. Identified BIOS misconfiguration during maintenance. Updated boot settings and verified full functionality.,2024-06-15T12:00:00,2024-06-16T05:00:00,Agent_A
TKT-0220,SSO not working for Office 365,Single Sign-On to Office 365 failing for users in OU=Engineering OU. SAML assertion error in logs.,Access Management,High,resolved,Found SAML attribute mapping broken after directory OU rename. Updated SP configuration with correct OU path. SSO tested and confirmed working for all users.,2024-07-13T05:08:00,2024-07-13T10:08:00,Agent_D
TKT-0221,Slow performance in ERP module,ERP system HR module responding slowly. Average response time 15 seconds vs normal 0.5s.,Application,Medium,resolved,Found missing database index on frequently queried column. Created index in low-traffic window. Response time reduced from 8s to 0.4s.,2024-02-09T11:16:00,2024-02-10T11:16:00,Agent_E
TKT-0222,DNS resolution failing,DNS unable to resolve internal hostnames. Issue started after changes to DNS server DNS-2. Services affected.,Network,Medium,resolved,Found circular DNS entry created during server migration. Removed circular reference. Flushed DNS cache on all servers. Internal name resolution restored.,2024-07-21T10:53:00,2024-07-22T00:53:00,Agent_C
TKT-0223,Statistics need updating,Query optimizer choosing wrong execution plan on HRDB. Updating statistics should resolve performance issue.,Database,Low,resolved,Updated statistics on all tables in affected database. Cached query plans cleared. Execution plan now optimal. Query performance restored to baseline.,2024-12-21T06:30:00,2024-12-23T16:30:00,Agent_C
TKT-0224,USB drive policy violation,Inventory system flagged user raj.kumar using unauthorized USB drive on secured workstation.,Security,Medium,resolved,User counseled on acceptable use policy. USB drive contents scanned and cleared. Blocked USB storage class on endpoint via group policy.,2024-05-23T12:23:00,2024-05-24T10:23:00,Agent_E
TKT-0225,Network switch port misconfigured,Switch port on rack R18 misconfigured as trunk. VLAN 16 traffic bleeding. Isolate affected systems.,Network,Medium,resolved,Corrected switch port VLAN configuration. Changed from trunk to access mode on VLAN 10. Verified no more VLAN bleeding. Documented correct configuration.,2024-12-28T06:28:00,2024-12-28T12:28:00,Agent_D
TKT-0228,CSV import failing,Data import tool fails when processing CSV files larger than 7MB. Memory exception in logs.,Application,Low,resolved,Identified memory constraint in import service. Updated JVM heap size from 512MB to 2GB. CSV imports up to 500MB now working correctly.,2024-11-27T12:48:00,2024-11-28T09:48:00,Agent_A
TKT-0229,Data center cooling alert,Cooling system in DC-2 reporting high temperature warning. Room temp at 36°C. Need HVAC check.,Infrastructure,High,resolved,Escalated to data center team. HVAC unit serviced and repaired. Temperature normalized within safe operating range. No hardware damage detected.,2024-12-18T18:14:00,2024-12-19T02:14:00,Agent_D
TKT-0230,Guest user access request,External partner from PartnerInc needs guest access to SharePoint project site for bid preparation.,Access Management,Low,resolved,Created guest account with time-limited access (30 days). Restricted to specific SharePoint site. Sent invite to external partner. Access documented in ITSM.,2024-02-23T09:26:00,2024-02-24T11:26:00,Agent_C
TKT-0231,Data breach notification received,Third-party vendor AWS notified of data breach potentially affecting 235 user records.,Security,High,resolved,Initiated vendor breach response protocol. Identified affected accounts. Forced password resets. Enabled enhanced monitoring for affected user subset.,2024-02-19T14:46:00,2024-02-19T22:46:00,Agent_C
TKT-0232,VM not starting after maintenance,Virtual machine VM-123 fails to boot after scheduled maintenance window. Error: kernel panic at boot.,Infrastructure,Medium,resolved,Restored VM from last known good snapshot. Identified BIOS misconfiguration during maintenance. Updated boot settings and verified full functionality.,2024-12-12T05:59:00,2024-12-13T01:59:00,Agent_E
TKT-0233,Email notifications not sending,Automated email notifications from ServiceNow system stopped working. SMTP errors in logs since yesterday.,Application,Medium,resolved,SMTP server certificate expired. Renewed certificate and restarted mail relay service. Email notifications resumed. Added certificate expiry monitoring.,2024-07-26T20:11:00,2024-07-27T20:11:00,Agent_D
TKT-0234,Server reboot required after patch,Patch KB70340936 applied to SRV-26. Server requires reboot to complete patching. Schedule downtime needed.,Infrastructure,Low,resolved,Scheduled reboot during off-peak hours at 11 PM. Coordinated with business stakeholders. Reboot completed successfully in 8 minutes.,2024-12-26T06:13:00,2024-12-27T03:13:00,Agent_E
TKT-0235,Email notifications not sending,Automated email notifications from Jira system stopped working. SMTP errors in logs since yesterday.,Application,High,resolved,SMTP server certificate expired. Renewed certificate and restarted mail relay service. Email notifications resumed. Added certificate expiry monitoring.,2024-09-07T16:40:00,2024-09-07T22:40:00,Agent_E
TKT-0237,Ransomware alert on endpoint,Antivirus detected ransomware attempt on workstation WS-4908. Files in Documents folder encrypted. Machine isolated.,Security,High,resolved,Contained incident: isolated machine from network. Engaged IR team. Restored from clean backup. Deployed enhanced endpoint protection. Root cause: malicious email attachment.,2024-12-21T04:32:00,2024-12-21T11:32:00,Agent_E
TKT-0239,Email notifications not sending,Automated email notifications from Workday system stopped working. SMTP errors in logs since yesterday.,Application,Medium,resolved,SMTP server certificate expired. Renewed certificate and restarted mail relay service. Email notifications resumed. Added certificate expiry monitoring.,2024-07-02T00:31:00,2024-07-02T10:31:00,Agent_E
TKT-0241,SSL certificate expiring soon,SSL certificate for app.company.com expires in 22 days. Renewal required to prevent browser warnings.,Security,Medium,resolved,Renewed SSL certificate via DigiCert. Deployed to all web servers and load balancers. Certificate monitoring automated for 60-day renewal alerts.,2024-09-10T17:32:00,2024-09-11T15:32:00,Agent_C
TKT-0242,Wi-Fi dead zone in conference room,Conference room C-293 has no Wi-Fi coverage. AP-15 appears offline. Meeting disruptions daily.,Network,Low,resolved,Replaced offline AP with spare unit. Configured with matching SSID and security settings. Signal strength confirmed in conference room. Users connecting successfully.,2024-04-21T13:06:00,2024-04-22T01:06:00,Agent_D
TKT-0251,Mobile app crashing on iOS,Company mobile app crashes on iOS 14.2 devices after latest update. Android users unaffected.,Application,Medium,resolved,Identified crash caused by deprecated API call in iOS 17. Submitted emergency fix. Temporary rollback to previous version available for affected users.,2024-11-28T05:03:00,2024-11-29T05:03:00,Agent_B
TKT-0252,Query performance degradation,Critical report query in PRODDB01 taking 100 minutes vs previous 5 seconds. Missing index suspected.,Database,High,resolved,"Identified missing composite index on (customer_id, order_date) columns. Created index during off-hours. Query time reduced from 8 minutes to 3 seconds.",2024-10-30T07:33:00,2024-10-30T15:33:00,Agent_C
TKT-0253,Hardware failure on blade server,Blade server BLD-5 in chassis CH-8 reporting memory ECC errors. Server is unstable.,Infrastructure,Medium,resolved,Ran memory diagnostics confirming faulty DIMM. Scheduled maintenance window. Replaced failed memory module. Server stable with no further ECC errors.,2024-02-22T03:20:00,2024-02-22T16:20:00,Agent_D
TKT-0254,Report generation failing,Monthly Operations report fails to generate. Process hangs at 77% and times out after 30 minutes.,Application,Medium,resolved,Increased report generation timeout from 30 to 120 minutes. Optimized underlying SQL query. Report now generating in 22 minutes.,2024-03-25T14:22:00,2024-03-26T14:22:00,Agent_D
TKT-0255,BGP route flapping detected,BGP route flapping detected on ISP link Airtel. Packet loss 81% affecting cloud connectivity.,Network,High,resolved,Coordinated with ISP to address BGP route instability. ISP applied route dampening and fixed misconfigured peer. Route stabilized. Packet loss back to 0%.,2024-03-04T18:46:00,2024-03-05T01:46:00,Agent_C
TKT-0259,Query performance degradation,Critical report query in PRODDB01 taking 12 minutes vs previous 20 seconds. Missing index suspected.,Database,High,resolved,"Identified missing composite index on (customer_id, order_date) columns. Created index during off-hours. Query time reduced from 8 minutes to 3 seconds.",2024-01-31T12:32:00,2024-01-31T17:32:00,Agent_D
TKT-0260,Storage auto-growth disabled,Database CRMDB log file at 77% capacity with auto-growth disabled. Manual expansion needed.,Database,Medium,resolved,Expanded log file by 50GB and re-enabled auto-growth with 20% increment. Added disk space alert at 80% threshold. Resolved without service impact.,2024-02-12T09:05:00,2024-02-12T17:05:00,Agent_D
TKT-0262,Server down in production,Production server SRV-91 is completely unresponsive. Multiple services affected. CPU usage was at 79% before crash. Need immediate restore.,Infrastructure,High,resolved,Performed emergency restart of server services. Identified root cause as memory leak in application daemon. Applied workaround by scheduling daily restart until patch available.,2024-06-26T16:33:00,2024-06-26T21:33:00,Agent_B
TKT-0263,Terminated employee access not revoked,Former employee Karan Shah account still active 55 days after termination date 2024-01-11. Security risk.,Access Management,High,resolved,"Immediately disabled former employee AD account, revoked all application licenses, invalidated VPN certificates. Conducted access audit. No unauthorized access detected.",2024-10-22T20:04:00,2024-10-23T04:04:00,Agent_A
TKT-0264,Statistics need updating,Query optimizer choosing wrong execution plan on HRDB. Updating statistics should resolve performance issue.,Database,Low,resolved,Updated statistics on all tables in affected database. Cached query plans cleared. Execution plan now optimal. Query performance restored to baseline.,2024-02-22T18:43:00,2024-02-23T02:43:00,Agent_A
TKT-0265,Backup job failed overnight,Scheduled backup for SRV-06 failed at 15:23. Backup logs show timeout after 59 minutes. Data not protected.,Infrastructure,Medium,resolved,Investigated backup failure root cause: network timeout. Extended backup timeout parameter and re-ran backup job successfully. Added monitoring alert.,2024-01-19T17:51:00,2024-01-20T04:51:00,Agent_B
TKT-0266,Table lock causing deadlock,Deadlock detected in PRODDB01 on table invoices. 140 transactions rolled back. Application throwing errors.,Database,High,resolved,Identified deadlock pattern in application transaction order. Worked with dev team to reorder table access in transactions. Deadlocks eliminated.,2024-01-27T05:14:00,2024-01-27T06:14:00,Agent_D
TKT-0267,Firewall rule review needed,"Quarterly firewall audit found 169 outdated rules allowing unnecessary inbound traffic on ports 6685, 37271.",Security,Medium,resolved,Removed 12 outdated firewall rules after business validation. Applied least-privilege ruleset. Documented changes in change management system.,2024-05-29T18:50:00,2024-05-30T17:50:00,Agent_D
TKT-0269,Backup job failed overnight,Scheduled backup for SRV-70 failed at 11:40. Backup logs show timeout after 117 minutes. Data not protected.,Infrastructure,Medium,resolved,Investigated backup failure root cause: network timeout. Extended backup timeout parameter and re-ran backup job successfully. Added monitoring alert.,2024-06-20T00:48:00,2024-06-20T13:48:00,Agent_B
TKT-0270,DNS resolution failing,DNS unable to resolve internal hostnames. Issue started after changes to DNS server DNS-2. Services affected.,Network,High,resolved,Found circular DNS entry created during server migration. Removed circular reference. Flushed DNS cache on all servers. Internal name resolution restored.,2024-03-13T22:17:00,2024-03-14T00:17:00,Agent_E
TKT-0271,Table lock causing deadlock,Deadlock detected in PRODDB01 on table invoices. 236 transactions rolled back. Application throwing errors.,Database,High,resolved,Identified deadlock pattern in application transaction order. Worked with dev team to reorder table access in transactions. Deadlocks eliminated.,2024-07-20T02:37:00,2024-07-20T03:37:00,Agent_B
TKT-0273,CSV import failing,Data import tool fails when processing CSV files larger than 11MB. Memory exception in logs.,Application,High,resolved,Identified memory constraint in import service. Updated JVM heap size from 512MB to 2GB. CSV imports up to 500MB now working correctly.,2024-06-09T13:07:00,2024-06-09T19:07:00,Agent_C
TKT-0274,Database backup failed,Nightly backup of PRODDB01 database failed. Backup logs show insufficient disk space on backup server.,Database,Low,resolved,Manual backup triggered after expanding backup storage by 500GB. Verified backup integrity. Automated daily backups re-enabled with increased storage threshold.,2024-12-26T22:38:00,2024-12-28T23:38:00,Agent_B
TKT-0275,Backup job failed overnight,Scheduled backup for SRV-46 failed at 12:32. Backup logs show timeout after 16 minutes. Data not protected.,Infrastructure,Medium,resolved,Investigated backup failure root cause: network timeout. Extended backup timeout parameter and re-ran backup job successfully. Added monitoring alert.,2024-03-30T00:25:00,2024-03-30T21:25:00,Agent_A
TKT-0277,Bandwidth saturation on WAN link,WAN link to branch Mumbai saturated at 77% capacity during business hours. Conference calls dropping.,Network,High,resolved,Identified backup data replication saturating WAN link during business hours. Rescheduled backup replication to 10 PM - 4 AM window. Daytime bandwidth freed.,2024-11-26T14:51:00,2024-11-26T17:51:00,Agent_A
TKT-0278,Disk space running low on server,File server SVR-11 disk usage at 76%. Approaching capacity. Archive or expand needed.,Infrastructure,Low,resolved,Archived old log files and temporary data. Freed 320GB. Sent capacity report to management for storage expansion planning.,2024-07-21T15:01:00,2024-07-22T21:01:00,Agent_C
TKT-0279,Report generation failing,Monthly Compliance report fails to generate. Process hangs at 83% and times out after 30 minutes.,Application,Medium,resolved,Increased report generation timeout from 30 to 120 minutes. Optimized underlying SQL query. Report now generating in 22 minutes.,2024-11-10T19:39:00,2024-11-11T19:39:00,Agent_D
TKT-0280,Database user permissions mismatch,Application service account svc_app missing SELECT permission on new employees table after migration.,Database,Medium,resolved,Granted required SELECT permissions to service account on new tables. Updated application configuration. Tested full application workflow successfully.,2024-04-12T20:56:00,2024-04-13T20:56:00,Agent_D
TKT-0281,Password reset request,User raj.kumar locked out of account after 247 failed attempts. Needs password reset with identity verification.,Access Management,Low,resolved,Verified user identity via manager confirmation and security questions. Reset password and unlocked account. Notified user via alternate contact method.,2024-10-16T16:20:00,2024-10-17T23:20:00,Agent_A
TKT-0282,Password policy compliance issue,Audit found 114 user accounts not compliant with new password policy. Force reset required.,Security,Medium,resolved,Generated list of non-compliant accounts. Sent notifications. Enforced immediate password change via Group Policy. Compliance now at 100%.,2024-08-29T16:22:00,2024-08-30T01:22:00,Agent_B
TKT-0285,Application license expired,License for ServiceNow expired on 2025-03-16. Users getting license error. Need renewal or temp key.,Application,High,resolved,Contacted vendor support. Received 90-day emergency license extension. Submitted formal renewal order through procurement. Users back to normal.,2024-04-22T00:33:00,2024-04-22T08:33:00,Agent_E
TKT-0287,Wi-Fi dead zone in conference room,Conference room A-195 has no Wi-Fi coverage. AP-94 appears offline. Meeting disruptions daily.,Network,Low,resolved,Replaced offline AP with spare unit. Configured with matching SSID and security settings. Signal strength confirmed in conference room. Users connecting successfully.,2024-06-03T10:08:00,2024-06-06T08:08:00,Agent_C
TKT-0292,Firewall rule review needed,"Quarterly firewall audit found 404 outdated rules allowing unnecessary inbound traffic on ports 8104, 48237.",Security,Medium,resolved,Removed 12 outdated firewall rules after business validation. Applied least-privilege ruleset. Documented changes in change management system.,2024-08-02T05:56:00,2024-08-03T00:56:00,Agent_C
TKT-0294,Data center cooling alert,Cooling system in DC-1 reporting high temperature warning. Room temp at 33°C. Need HVAC check.,Infrastructure,High,resolved,Escalated to data center team. HVAC unit serviced and repaired. Temperature normalized within safe operating range. No hardware damage detected.,2024-06-24T05:56:00,2024-06-24T12:56:00,Agent_E
TKT-0297,Hardware failure on blade server,Blade server BLD-16 in chassis CH-3 reporting memory ECC errors. Server is unstable.,Infrastructure,High,resolved,Ran memory diagnostics confirming faulty DIMM. Scheduled maintenance window. Replaced failed memory module. Server stable with no further ECC errors.,2024-05-30T21:40:00,2024-05-31T05:40:00,Agent_A
TKT-0298,Report generation failing,Monthly Compliance report fails to generate. Process hangs at 95% and times out after 30 minutes.,Application,Medium,resolved,Increased report generation timeout from 30 to 120 minutes. Optimized underlying SQL query. Report now generating in 22 minutes.,2024-02-29T09:50:00,2024-03-01T04:50:00,Agent_C
TKT-0299,Physical server needs RAM upgrade,"Server SRV-50 experiencing frequent swap usage. Currently 16GB, need upgrade to 64GB for workload.",Infrastructure,Medium,resolved,Submitted hardware upgrade request to procurement. Approved expedited delivery. Memory expansion scheduled for next maintenance window.,2024-08-16T01:16:00,2024-08-16T19:16:00,Agent_B
TKT-0301,Hardware failure on blade server,Blade server BLD-14 in chassis CH-8 reporting memory ECC errors. Server is unstable.,Infrastructure,High,resolved,Ran memory diagnostics confirming faulty DIMM. Scheduled maintenance window. Replaced failed memory module. Server stable with no further ECC errors.,2024-06-02T02:25:00,2024-06-02T03:25:00,Agent_A
TKT-0302,Replication lag detected,Database replication lag on HRDB slave is 7 seconds behind master. Risk of stale reads.,Database,Medium,resolved,Found replication lag caused by large transaction on master. Optimized transaction to use batch processing. Replica caught up within 15 minutes.,2024-08-04T02:43:00,2024-08-04T12:43:00,Agent_E
TKT-0303,Data breach notification received,Third-party vendor Salesforce notified of data breach potentially affecting 468 user records.,Security,Low,resolved,Initiated vendor breach response protocol. Identified affected accounts. Forced password resets. Enabled enhanced monitoring for affected user subset.,2024-06-15T08:33:00,2024-06-17T21:33:00,Agent_A
TKT-0305,VPN security patch needed,Critical security patch CVE-2024-84976 available for VPN gateway. Exploitation in wild reported.,Security,High,resolved,Applied VPN gateway security patch in emergency maintenance window. Verified patch integrity via vendor hash. Restarted services. No exploitation detected.,2024-05-21T12:09:00,2024-05-21T19:09:00,Agent_C
TKT-0307,Query performance degradation,Critical report query in FINDB taking 39 minutes vs previous 6 seconds. Missing index suspected.,Database,High,resolved,"Identified missing composite index on (customer_id, order_date) columns. Created index during off-hours. Query time reduced from 8 minutes to 3 seconds.",2024-06-13T08:46:00,2024-06-13T15:46:00,Agent_B
TKT-0309,Antivirus definitions outdated,Symantec AV definitions on 208 endpoints are 18 days out of date. Update push needed.,Security,Low,resolved,Pushed emergency AV definition update via SCCM. Confirmed update on all endpoints within 2 hours. Scheduled automatic daily definition updates.,2024-10-18T00:11:00,2024-10-18T15:11:00,Agent_B
TKT-0310,Disk space running low on server,File server SVR-24 disk usage at 76%. Approaching capacity. Archive or expand needed.,Infrastructure,Low,resolved,Archived old log files and temporary data. Freed 320GB. Sent capacity report to management for storage expansion planning.,2024-08-25T16:25:00,2024-08-27T06:25:00,Agent_C
TKT-0311,Statistics need updating,Query optimizer choosing wrong execution plan on ANALYTICSDB. Updating statistics should resolve performance issue.,Database,Medium,resolved,Updated statistics on all tables in affected database. Cached query plans cleared. Execution plan now optimal. Query performance restored to baseline.,2024-06-28T11:10:00,2024-06-28T17:10:00,Agent_A
TKT-0312,Database connection pool exhausted,Production DB CRMDB connection pool maxed out at 85 connections. New requests queuing. Service degradation.,Database,High,resolved,Identified connection leak in application code. Applied hotfix to properly close connections. Increased connection pool size temporarily. Normal operations resumed.,2024-04-23T20:14:00,2024-04-24T00:14:00,Agent_E
TKT-0313,Server down in production,Production server SRV-61 is completely unresponsive. Multiple services affected. CPU usage was at 79% before crash. Need immediate restore.,Infrastructure,High,resolved,Performed emergency restart of server services. Identified root cause as memory leak in application daemon. Applied workaround by scheduling daily restart until patch available.,2024-01-05T07:16:00,2024-01-05T12:16:00,Agent_D
TKT-0315,Guest user access request,External partner from VendorLtd needs guest access to SharePoint project site for bid preparation.,Access Management,Low,resolved,Created guest account with time-limited access (30 days). Restricted to specific SharePoint site. Sent invite to external partner. Access documented in ITSM.,2024-02-02T10:17:00,2024-02-04T03:17:00,Agent_C
TKT-0317,Firewall rule review needed,"Quarterly firewall audit found 466 outdated rules allowing unnecessary inbound traffic on ports 28455, 27539.",Security,Medium,resolved,Removed 12 outdated firewall rules after business validation. Applied least-privilege ruleset. Documented changes in change management system.,2024-12-28T18:52:00,2024-12-29T08:52:00,Agent_E
TKT-0319,Terminated employee access not revoked,Former employee Arjun Mehta account still active 84 days after termination date 2024-11-11. Security risk.,Access Management,High,resolved,"Immediately disabled former employee AD account, revoked all application licenses, invalidated VPN certificates. Conducted access audit. No unauthorized access detected.",2024-06-06T13:50:00,2024-06-06T19:50:00,Agent_E
TKT-0323,Database backup failed,Nightly backup of HRDB database failed. Backup logs show insufficient disk space on backup server.,Database,Medium,resolved,Manual backup triggered after expanding backup storage by 500GB. Verified backup integrity. Automated daily backups re-enabled with increased storage threshold.,2024-03-22T15:50:00,2024-03-22T23:50:00,Agent_D
TKT-0324,Storage auto-growth disabled,Database ANALYTICSDB log file at 90% capacity with auto-growth disabled. Manual expansion needed.,Database,Low,resolved,Expanded log file by 50GB and re-enabled auto-growth with 20% increment. Added disk space alert at 80% threshold. Resolved without service impact.,2024-07-10T00:57:00,2024-07-11T08:57:00,Agent_A
TKT-0325,New employee account setup needed,"New hire Karan Shah starting 2024-04-23 needs AD account, email, VPN, and application access per role HR Manager.",Access Management,Medium,resolved,"Created AD user account, mail-enabled, added to distribution groups per role template. Provided access to required applications. New hire onboarding checklist completed.",2024-06-05T05:04:00,2024-06-05T18:04:00,Agent_D
TKT-0327,Database connection pool exhausted,Production DB HRDB connection pool maxed out at 118 connections. New requests queuing. Service degradation.,Database,High,resolved,Identified connection leak in application code. Applied hotfix to properly close connections. Increased connection pool size temporarily. Normal operations resumed.,2024-01-12T18:32:00,2024-01-12T21:32:00,Agent_A
