ticket_id,title,description,category,priority,status,resolution,created_at,resolved_at,assigned_agent
TKT-0433,Password policy compliance issue,Audit found 63 user accounts not compliant with new password policy. Force reset required.,Security,Low,resolved,Generated list of non-compliant accounts. Sent notifications. Enforced immediate password change via Group Policy. Compliance now at 100%.,2024-01-22T18:50:00,2024-01-23T21:50:00,Agent_C
TKT-0435,SSO not working for Office 365,Single Sign-On to Office 365 failing for users in OU=Sales OU. SAML assertion error in logs.,Access Management,High,resolved,Found SAML attribute mapping broken after directory OU rename. Updated SP configuration with correct OU path. SSO tested and confirmed working for all users.,2024-10-12T20:48:00,2024-10-13T02:48:00,Agent_A
TKT-0436,Access review overdue,Semi-annual access review for Finance department overdue by 46 days. Compliance audit approaching.,Access Management,Medium,resolved,Completed access review for department. Removed 23 excessive permissions across 8 users. Updated access documentation. Submitted compliance report.,2024-12-27T14:35:00,2024-12-28T11:35:00,Agent_B
TKT-0437,Network switch port misconfigured,Switch port on rack R18 misconfigured as trunk. VLAN 99 traffic bleeding. Isolate affected systems.,Network,Medium,resolved,Corrected switch port VLAN configuration. Changed from trunk to access mode on VLAN 10. Verified no more VLAN bleeding. Documented correct configuration.,2024-11-02T17:10:00,2024-11-03T13:10:00,Agent_D
TKT-0438,Firewall rule review needed,"Quarterly firewall audit found 279 outdated rules allowing unnecessary inbound traffic on ports 25083, 30782.",Security,Low,resolved,Removed 12 outdated firewall rules after business validation. Applied least-privilege ruleset. Documented changes in change management system.,2024-04-04T00:39:00,2024-04-05T14:39:00,Agent_C
TKT-0439,Cannot access shared drive after role change,User maria.garcia moved to Operations department but still has access to previous department shared drives.,Access Management,Medium,resolved,Revoked access to previous department shares per role change procedure. Granted access to new department resources. Updated access matrix documentation.,2024-12-15T15:49:00,2024-12-16T14:49:00,Agent_C
TKT-0440,Table lock causing deadlock,Deadlock detected in PRODDB01 on table invoices. 58 transactions rolled back. Application throwing errors.,Database,High,resolved,Identified deadlock pattern in application transaction order. Worked with dev team to reorder table access in transactions. Deadlocks eliminated.,2024-03-07T05:55:00,2024-03-07T06:55:00,Agent_D
TKT-0441,Slow performance in ERP module,ERP system Finance module responding slowly. Average response time 20 seconds vs normal 0.5s.,Application,Medium,resolved,Found missing database index on frequently queried column. Created index in low-traffic window. Response time reduced from 8s to 0.4s.,2024-09-07T16:39:00,2024-09-07T21:39:00,Agent_B
TKT-0444,API integration broken,Integration between Oracle and ServiceNow API stopped working. 401 Unauthorized errors since 2024-10-21.,Application,High,resolved,API token expired and not auto-refreshed. Updated integration configuration with new token and implemented auto-refresh mechanism. Integration restored.,2024-10-12T13:47:00,2024-10-12T15:47:00,Agent_D
TKT-0445,Access review overdue,Semi-annual access review for Finance department overdue by 14 days. Compliance audit approaching.,Access Management,Medium,resolved,Completed access review for department. Removed 23 excessive permissions across 8 users. Updated access documentation. Submitted compliance report.,2024-09-15T10:42:00,2024-09-16T07:42:00,Agent_C
TKT-0446,Antivirus definitions outdated,Symantec AV definitions on 168 endpoints are 48 days out of date. Update push needed.,Security,Low,resolved,Pushed emergency AV definition update via SCCM. Confirmed update on all endpoints within 2 hours. Scheduled automatic daily definition updates.,2024-06-14T19:15:00,2024-06-16T11:15:00,Agent_C
TKT-0447,Failed migration rollback needed,Schema migration v17.0 on PRODDB01 failed halfway. Partial changes applied. Need clean rollback.,Database,High,resolved,Executed rollback script to undo partial migration changes. Verified database consistency. Fixed migration script for next attempt. Scheduled retry for weekend.,2024-09-22T04:56:00,2024-09-22T09:56:00,Agent_B
TKT-0449,Table lock causing deadlock,Deadlock detected in HRDB on table transactions. 81 transactions rolled back. Application throwing errors.,Database,High,resolved,Identified deadlock pattern in application transaction order. Worked with dev team to reorder table access in transactions. Deadlocks eliminated.,2024-04-29T08:51:00,2024-04-29T13:51:00,Agent_E
TKT-0450,Slow performance in ERP module,ERP system Procurement module responding slowly. Average response time 27 seconds vs normal 0.5s.,Application,Medium,resolved,Found missing database index on frequently queried column. Created index in low-traffic window. Response time reduced from 8s to 0.4s.,2024-12-19T22:36:00,2024-12-20T21:36:00,Agent_A
TKT-0452,CSV import failing,Data import tool fails when processing CSV files larger than 5MB. Memory exception in logs.,Application,Low,resolved,Identified memory constraint in import service. Updated JVM heap size from 512MB to 2GB. CSV imports up to 500MB now working correctly.,2024-01-28T09:33:00,2024-01-29T12:33:00,Agent_C
TKT-0454,VPN security patch needed,Critical security patch CVE-2023-27326 available for VPN gateway. Exploitation in wild reported.,Security,High,resolved,Applied VPN gateway security patch in emergency maintenance window. Verified patch integrity via vendor hash. Restarted services. No exploitation detected.,2024-01-26T17:25:00,2024-01-26T22:25:00,Agent_E
TKT-0455,Replication lag detected,Database replication lag on HRDB slave is 26 seconds behind master. Risk of stale reads.,Database,Medium,resolved,Found replication lag caused by large transaction on master. Optimized transaction to use batch processing. Replica caught up within 15 minutes.,2024-07-21T20:36:00,2024-07-22T17:36:00,Agent_B
TKT-0456,Data center cooling alert,Cooling system in DC-4 reporting high temperature warning. Room temp at 33°C. Need HVAC check.,Infrastructure,High,resolved,Escalated to data center team. HVAC unit serviced and repaired. Temperature normalized within safe operating range. No hardware damage detected.,2024-02-27T21:26:00,2024-02-28T04:26:00,Agent_B
TKT-0457,Data breach notification received,Third-party vendor Salesforce notified of data breach potentially affecting 306 user records.,Security,High,resolved,Initiated vendor breach response protocol. Identified affected accounts. Forced password resets. Enabled enhanced monitoring for affected user subset.,2024-06-28T19:52:00,2024-06-29T03:52:00,Agent_D
TKT-0461,Unauthorized access attempt,Multiple failed login attempts (104 in 01:18 mins) on user account maria.garcia detected. Account locked.,Security,High,resolved,Account locked per security policy after threshold reached. Verified user identity via secondary channel. Unlocked and reset credentials. Geo-block rule applied.,2024-12-01T00:04:00,2024-12-01T07:04:00,Agent_A
TKT-0462,Data center cooling alert,Cooling system in DC-4 reporting high temperature warning. Room temp at 31°C. Need HVAC check.,Infrastructure,High,resolved,Escalated to data center team. HVAC unit serviced and repaired. Temperature normalized within safe operating range. No hardware damage detected.,2024-12-29T03:57:00,2024-12-29T09:57:00,Agent_B
TKT-0463,Workflow stuck in pending state,Purchase approval workflow in Confluence stuck for 289 requests. Approver receives no notifications.,Application,Medium,resolved,Found approver notification email rule misconfigured after mail server migration. Updated notification templates. All pending approvals re-triggered.,2024-05-06T16:19:00,2024-05-07T11:19:00,Agent_B
TKT-0464,UPS battery low warning,UPS unit in rack R12 reporting battery at 96% charge. Risk of power loss during outage.,Infrastructure,Medium,resolved,Replaced faulty UPS battery module. Performed load test to confirm 2-hour backup capacity. Scheduled regular quarterly battery health checks.,2024-09-13T08:51:00,2024-09-14T08:51:00,Agent_D
TKT-0465,Physical server needs RAM upgrade,"Server SRV-36 experiencing frequent swap usage. Currently 16GB, need upgrade to 64GB for workload.",Infrastructure,Low,resolved,Submitted hardware upgrade request to procurement. Approved expedited delivery. Memory expansion scheduled for next maintenance window.,2024-07-20T21:08:00,2024-07-22T10:08:00,Agent_D
TKT-0466,CSV import failing,Data import tool fails when processing CSV files larger than 14MB. Memory exception in logs.,Application,Low,resolved,Identified memory constraint in import service. Updated JVM heap size from 512MB to 2GB. CSV imports up to 500MB now working correctly.,2024-11-05T10:28:00,2024-11-06T11:28:00,Agent_E
TKT-0468,Physical server needs RAM upgrade,"Server SRV-69 experiencing frequent swap usage. Currently 16GB, need upgrade to 64GB for workload.",Infrastructure,Low,resolved,Submitted hardware upgrade request to procurement. Approved expedited delivery. Memory expansion scheduled for next maintenance window.,2024-06-11T04:46:00,2024-06-13T16:46:00,Agent_D
TKT-0470,Application crash on login,Users cannot log into Workday. Application crashes immediately after entering credentials. Error: NullPointerException.,Application,High,resolved,Identified null session cookie causing crash. Applied hotfix patch v2.3.1. Deployed to production after UAT. All users successfully logging in.,2024-11-06T18:39:00,2024-11-06T22:39:00,Agent_B
TKT-0471,New employee account setup needed,"New hire Neha Gupta starting 2025-02-23 needs AD account, email, VPN, and application access per role Business Analyst.",Access Management,Medium,resolved,"Created AD user account, mail-enabled, added to distribution groups per role template. Provided access to required applications. New hire onboarding checklist completed.",2024-12-30T20:23:00,2024-12-31T12:23:00,Agent_D
TKT-0474,Password reset request,User raj.kumar locked out of account after 203 failed attempts. Needs password reset with identity verification.,Access Management,Low,resolved,Verified user identity via manager confirmation and security questions. Reset password and unlocked account. Notified user via alternate contact method.,2024-10-01T16:41:00,2024-10-02T13:41:00,Agent_D
TKT-0475,Database connection pool exhausted,Production DB HRDB connection pool maxed out at 451 connections. New requests queuing. Service degradation.,Database,High,resolved,Identified connection leak in application code. Applied hotfix to properly close connections. Increased connection pool size temporarily. Normal operations resumed.,2024-01-21T17:24:00,2024-01-21T18:24:00,Agent_D
TKT-0476,Database backup failed,Nightly backup of FINDB database failed. Backup logs show insufficient disk space on backup server.,Database,Medium,resolved,Manual backup triggered after expanding backup storage by 500GB. Verified backup integrity. Automated daily backups re-enabled with increased storage threshold.,2024-11-09T01:44:00,2024-11-09T19:44:00,Agent_A
TKT-0479,VM not starting after maintenance,Virtual machine VM-823 fails to boot after scheduled maintenance window. Error: kernel panic at boot.,Infrastructure,Medium,resolved,Restored VM from last known good snapshot. Identified BIOS misconfiguration during maintenance. Updated boot settings and verified full functionality.,2024-09-25T22:24:00,2024-09-26T14:24:00,Agent_A
TKT-0481,USB drive policy violation,Inventory system flagged user bob.wilson using unauthorized USB drive on secured workstation.,Security,Medium,resolved,User counseled on acceptable use policy. USB drive contents scanned and cleared. Blocked USB storage class on endpoint via group policy.,2024-03-08T06:00:00,2024-03-08T10:00:00,Agent_D
TKT-0482,Database user permissions mismatch,Application service account svc_monitor missing SELECT permission on new customers table after migration.,Database,Medium,resolved,Granted required SELECT permissions to service account on new tables. Updated application configuration. Tested full application workflow successfully.,2024-10-28T21:30:00,2024-10-29T14:30:00,Agent_A
TKT-0483,Load balancer health check failing,Load balancer LB-2 marking backend server SVR-01 as unhealthy. Traffic not distributed evenly.,Network,High,resolved,Resolved health check failure caused by SSL certificate mismatch. Updated load balancer SSL profile. Backend server passing health checks. Traffic balanced correctly.,2024-11-17T17:52:00,2024-11-17T21:52:00,Agent_B
TKT-0487,Terminated employee access not revoked,Former employee Priya Nair account still active 68 days after termination date 2025-09-14. Security risk.,Access Management,High,resolved,"Immediately disabled former employee AD account, revoked all application licenses, invalidated VPN certificates. Conducted access audit. No unauthorized access detected.",2024-02-25T18:46:00,2024-02-25T20:46:00,Agent_D
TKT-0488,Wi-Fi dead zone in conference room,Conference room B-234 has no Wi-Fi coverage. AP-83 appears offline. Meeting disruptions daily.,Network,Low,resolved,Replaced offline AP with spare unit. Configured with matching SSID and security settings. Signal strength confirmed in conference room. Users connecting successfully.,2024-03-07T19:36:00,2024-03-10T18:36:00,Agent_D
TKT-0490,Privileged access request for DBA,DBA team member raj.kumar needs temporary elevated DB access for weekend maintenance window.,Access Management,Medium,resolved,Granted time-limited privileged access via PAM system. Access auto-expires after maintenance window. All privileged actions logged. Access revoked on schedule.,2024-06-19T11:35:00,2024-06-19T15:35:00,Agent_C
TKT-0491,Ransomware alert on endpoint,Antivirus detected ransomware attempt on workstation WS-6042. Files in Documents folder encrypted. Machine isolated.,Security,High,resolved,Contained incident: isolated machine from network. Engaged IR team. Restored from clean backup. Deployed enhanced endpoint protection. Root cause: malicious email attachment.,2024-01-04T03:43:00,2024-01-04T09:43:00,Agent_E
TKT-0492,VPN users cannot connect,All remote VPN users unable to connect since 05:12. Error: IKE authentication failed. Office WFH impacted.,Network,High,resolved,Identified expired IKE certificate on VPN concentrator. Renewed certificate and restarted IKE service. All VPN users reconnecting successfully. Total downtime: 45 minutes.,2024-12-10T15:58:00,2024-12-10T23:58:00,Agent_D
TKT-0495,Database user permissions mismatch,Application service account svc_monitor missing SELECT permission on new orders table after migration.,Database,Medium,resolved,Granted required SELECT permissions to service account on new tables. Updated application configuration. Tested full application workflow successfully.,2024-02-29T09:45:00,2024-02-29T14:45:00,Agent_D
TKT-0498,Unauthorized access attempt,Multiple failed login attempts (482 in 03:52 mins) on user account raj.kumar detected. Account locked.,Security,High,resolved,Account locked per security policy after threshold reached. Verified user identity via secondary channel. Unlocked and reset credentials. Geo-block rule applied.,2024-01-19T14:24:00,2024-01-19T16:24:00,Agent_A
TKT-0500,Privileged access request for DBA,DBA team member bob.wilson needs temporary elevated DB access for weekend maintenance window.,Access Management,Medium,resolved,Granted time-limited privileged access via PAM system. Access auto-expires after maintenance window. All privileged actions logged. Access revoked on schedule.,2024-09-29T10:49:00,2024-09-29T17:49:00,Agent_B
TKT-0501,Mobile app crashing on iOS,Company mobile app crashes on iOS 14.0 devices after latest update. Android users unaffected.,Application,Medium,resolved,Identified crash caused by deprecated API call in iOS 17. Submitted emergency fix. Temporary rollback to previous version available for affected users.,2024-02-22T06:34:00,2024-02-23T03:34:00,Agent_C
TKT-0504,SSL certificate expiring soon,SSL certificate for portal.company.com expires in 60 days. Renewal required to prevent browser warnings.,Security,Medium,resolved,Renewed SSL certificate via DigiCert. Deployed to all web servers and load balancers. Certificate monitoring automated for 60-day renewal alerts.,2024-12-23T14:06:00,2024-12-24T03:06:00,Agent_D
TKT-0505,API integration broken,Integration between Salesforce and ServiceNow API stopped working. 401 Unauthorized errors since 2025-06-13.,Application,Low,resolved,API token expired and not auto-refreshed. Updated integration configuration with new token and implemented auto-refresh mechanism. Integration restored.,2024-06-15T14:31:00,2024-06-18T10:31:00,Agent_A
TKT-0506,USB drive policy violation,Inventory system flagged user alice.chen using unauthorized USB drive on secured workstation.,Security,Medium,resolved,User counseled on acceptable use policy. USB drive contents scanned and cleared. Blocked USB storage class on endpoint via group policy.,2024-06-27T19:36:00,2024-06-28T15:36:00,Agent_D
TKT-0508,Application license expired,License for Confluence expired on 2024-06-07. Users getting license error. Need renewal or temp key.,Application,High,resolved,Contacted vendor support. Received 90-day emergency license extension. Submitted formal renewal order through procurement. Users back to normal.,2024-08-10T18:50:00,2024-08-11T00:50:00,Agent_B
TKT-0509,Cannot access shared drive after role change,User maria.garcia moved to Operations department but still has access to previous department shared drives.,Access Management,Medium,resolved,Revoked access to previous department shares per role change procedure. Granted access to new department resources. Updated access matrix documentation.,2024-11-01T14:20:00,2024-11-02T08:20:00,Agent_C
TKT-0510,Query performance degradation,Critical report query in CRMDB taking 86 minutes vs previous 5 seconds. Missing index suspected.,Database,High,resolved,"Identified missing composite index on (customer_id, order_date) columns. Created index during off-hours. Query time reduced from 8 minutes to 3 seconds.",2024-09-10T20:42:00,2024-09-10T21:42:00,Agent_B
TKT-0511,VPN users cannot connect,All remote VPN users unable to connect since 04:42. Error: IKE authentication failed. Office WFH impacted.,Network,Low,resolved,Identified expired IKE certificate on VPN concentrator. Renewed certificate and restarted IKE service. All VPN users reconnecting successfully. Total downtime: 45 minutes.,2024-11-11T18:28:00,2024-11-13T18:28:00,Agent_C
TKT-0512,Bandwidth saturation on WAN link,WAN link to branch Bangalore saturated at 88% capacity during business hours. Conference calls dropping.,Network,High,resolved,Identified backup data replication saturating WAN link during business hours. Rescheduled backup replication to 10 PM - 4 AM window. Daytime bandwidth freed.,2024-11-09T16:25:00,2024-11-09T19:25:00,Agent_C
TKT-0517,Proxy filter blocking legitimate site,Corporate proxy blocking access to npmjs.com needed for project. Business justification submitted.,Network,Low,resolved,Added business exception rule for required site in proxy. Applied department-specific allow list. Users can now access required resource. Exception documented.,2024-04-25T05:27:00,2024-04-28T04:27:00,Agent_B
TKT-0518,SSO not working for Office 365,Single Sign-On to Office 365 failing for users in OU=Finance OU. SAML assertion error in logs.,Access Management,High,resolved,Found SAML attribute mapping broken after directory OU rename. Updated SP configuration with correct OU path. SSO tested and confirmed working for all users.,2024-07-06T01:02:00,2024-07-06T09:02:00,Agent_E
TKT-0520,Application license expired,License for Oracle EBS expired on 2024-11-21. Users getting license error. Need renewal or temp key.,Application,High,resolved,Contacted vendor support. Received 90-day emergency license extension. Submitted formal renewal order through procurement. Users back to normal.,2024-11-09T01:57:00,2024-11-09T07:57:00,Agent_D
TKT-0521,Database user permissions mismatch,Application service account svc_monitor missing SELECT permission on new employees table after migration.,Database,Medium,resolved,Granted required SELECT permissions to service account on new tables. Updated application configuration. Tested full application workflow successfully.,2024-05-30T09:10:00,2024-05-31T08:10:00,Agent_E
TKT-0522,Suspected phishing email received,User received suspicious email claiming to be from IT department asking for password reset. Possible phishing attack.,Security,High,resolved,Confirmed phishing attempt. Blocked sender domain at mail gateway. Collected and deleted all instances of email from mailboxes. Sent awareness advisory to all staff.,2024-10-20T01:42:00,2024-10-20T06:42:00,Agent_C
TKT-0523,Query performance degradation,Critical report query in PRODDB01 taking 26 minutes vs previous 18 seconds. Missing index suspected.,Database,High,resolved,"Identified missing composite index on (customer_id, order_date) columns. Created index during off-hours. Query time reduced from 8 minutes to 3 seconds.",2024-03-08T19:17:00,2024-03-09T00:17:00,Agent_A
TKT-0524,Network switch port misconfigured,Switch port on rack R19 misconfigured as trunk. VLAN 199 traffic bleeding. Isolate affected systems.,Network,Medium,resolved,Corrected switch port VLAN configuration. Changed from trunk to access mode on VLAN 10. Verified no more VLAN bleeding. Documented correct configuration.,2024-03-30T08:50:00,2024-03-31T03:50:00,Agent_E
TKT-0527,Database user permissions mismatch,Application service account svc_backup missing SELECT permission on new orders table after migration.,Database,Medium,resolved,Granted required SELECT permissions to service account on new tables. Updated application configuration. Tested full application workflow successfully.,2024-05-14T04:33:00,2024-05-14T08:33:00,Agent_D
TKT-0528,Table lock causing deadlock,Deadlock detected in CRMDB on table customers. 494 transactions rolled back. Application throwing errors.,Database,Low,resolved,Identified deadlock pattern in application transaction order. Worked with dev team to reorder table access in transactions. Deadlocks eliminated.,2024-08-09T19:58:00,2024-08-11T13:58:00,Agent_C
TKT-0530,Antivirus definitions outdated,Symantec AV definitions on 7 endpoints are 87 days out of date. Update push needed.,Security,High,resolved,Pushed emergency AV definition update via SCCM. Confirmed update on all endpoints within 2 hours. Scheduled automatic daily definition updates.,2024-02-20T16:06:00,2024-02-21T00:06:00,Agent_C
TKT-0531,SSL certificate expiring soon,SSL certificate for portal.company.com expires in 4 days. Renewal required to prevent browser warnings.,Security,Medium,resolved,Renewed SSL certificate via DigiCert. Deployed to all web servers and load balancers. Certificate monitoring automated for 60-day renewal alerts.,2024-10-31T21:57:00,2024-11-01T20:57:00,Agent_A
TKT-0533,USB drive policy violation,Inventory system flagged user maria.garcia using unauthorized USB drive on secured workstation.,Security,Medium,resolved,User counseled on acceptable use policy. USB drive contents scanned and cleared. Blocked USB storage class on endpoint via group policy.,2024-05-21T13:44:00,2024-05-22T01:44:00,Agent_A
TKT-0534,Suspected phishing email received,User received suspicious email claiming to be from IT department asking for password reset. Possible phishing attack.,Security,High,resolved,Confirmed phishing attempt. Blocked sender domain at mail gateway. Collected and deleted all instances of email from mailboxes. Sent awareness advisory to all staff.,2024-01-31T08:52:00,2024-01-31T13:52:00,Agent_A
TKT-0535,Corrupted data in customer table,314 records in customer table show NULL values in mandatory fields after last migration.,Database,High,resolved,Data corruption traced to failed migration script with incorrect NULL handling. Restored affected records from pre-migration backup. Validated data integrity.,2024-02-25T04:34:00,2024-02-25T11:34:00,Agent_D
TKT-0537,Email notifications not sending,Automated email notifications from Confluence system stopped working. SMTP errors in logs since yesterday.,Application,Medium,resolved,SMTP server certificate expired. Renewed certificate and restarted mail relay service. Email notifications resumed. Added certificate expiry monitoring.,2024-09-08T15:27:00,2024-09-08T21:27:00,Agent_A
TKT-0538,Failed migration rollback needed,Schema migration v14.2 on FINDB failed halfway. Partial changes applied. Need clean rollback.,Database,High,resolved,Executed rollback script to undo partial migration changes. Verified database consistency. Fixed migration script for next attempt. Scheduled retry for weekend.,2024-11-19T20:05:00,2024-11-20T02:05:00,Agent_A
TKT-0540,Query performance degradation,Critical report query in HRDB taking 90 minutes vs previous 16 seconds. Missing index suspected.,Database,High,resolved,"Identified missing composite index on (customer_id, order_date) columns. Created index during off-hours. Query time reduced from 8 minutes to 3 seconds.",2024-10-30T07:31:00,2024-10-30T14:31:00,Agent_D
TKT-0541,BGP route flapping detected,BGP route flapping detected on ISP link Airtel. Packet loss 75% affecting cloud connectivity.,Network,High,resolved,Coordinated with ISP to address BGP route instability. ISP applied route dampening and fixed misconfigured peer. Route stabilized. Packet loss back to 0%.,2024-01-22T12:07:00,2024-01-22T16:07:00,Agent_E
